[
    {
        "patrol_id": "mtn_bord_rogue1",
        "biome": ["mountainous"],
        "season": ["any"],
        "types": ["border"],
        "tags": [],
        "patrol_art": "bord_general_intro",
        "min_cats": 4,
        "max_cats": 6,
        "min_max_status": {},
        "weight": 20,
        "intro_text": "As the patrol is marking the border lines, a gang of rogues leaps out from behind a tumble of rocks! An ambush!",
        "decline_text": "The patrol turns tail and races away! The borders are left open for the rogues to muddy.",
        "chance_of_success": 20,
        "success_outcomes": [
            {
                "text": "The patrol descends into battle without a second thought, easily driving the rogues away as they use their knowledge of the rocky terrain to their advantage.",
                "exp": 30,
                "weight": 20,
                "art": "gen_bord_roguerunaway"
            },
            {
                "text": "s_c immediately leaps to protect {PRONOUN/s_c/poss} Clanmates. {PRONOUN/s_c/poss/CAP} ferocity in battle terrifies the rogues. Realizing that they've sorely underestimated the Clan cats, the rogues turn tail and run.",
                "exp": 30,
                "weight": 20,
                "stat_skill": ["FIGHTER,3"],
                "art": "gen_bord_roguerunaway"
            },
            {
                "text": "s_c revels in the battle, leaping into the fray with {PRONOUN/s_c/poss} teeth bared and claws unsheathed. The rogues are quickly driven away by the patrol.",
                "exp": 30,
                "weight": 20,
                "stat_trait": ["bloodthirsty", "fierce", "vengeful"],
                "art": "gen_bord_roguerunaway"
            },
            {
                "text": "The rogues posture and jeer, eventually provoking a battle. The Clan cats are strong, however, and the rogues seem to be weakened by hunger. The patrol easily drives the intruders away.",
                "exp": 30,
                "weight": 20,
                "relationships": [
                    {
                        "cats_to": ["patrol"],
                        "cats_from": ["patrol"],
                        "mutual": false,
                        "values": ["respect", "trust"],
                        "amount": 5
                    }
                ],
                "art": "gen_bord_roguerunaway"
            },
            {
                "text": "The rogues posture and jeer, eventually provoking a battle. The Clan cats are strong, however, and experienced at using the rocky terrain to their advantage, the rogues are forced to retreat.",
                "exp": 30,
                "weight": 5,
                "relationships": [
                    {
                        "cats_to": ["patrol"],
                        "cats_from": ["patrol"],
                        "mutual": false,
                        "values": ["respect", "trust"],
                        "amount": 5
                    }
                ],
                "art": "gen_bord_roguerunaway"
            },
            {
                "text": "s_c takes the lead, confronting the gang with confidence. Eventually the rogues admit that they've been struggling to find enough prey and were looking to steal richer territory from the Clan. Tensions are eased when s_c informs the rogues of a prey-rich meadow outside of c_n territory.",
                "exp": 30,
                "weight": 20,
                "stat_skill": ["SPEAKER,1"],
                "relationships": [
                    {
                        "cats_to": ["patrol"],
                        "cats_from": ["patrol"],
                        "mutual": false,
                        "values": ["respect", "trust"],
                        "amount": 5
                    }
                ],
                "art": "gen_bord_otherclan_allies"
            },
            {
                "text": "s_c takes the lead, confronting the gang with confidence. Eventually the rogues admit that they've been struggling to find enough prey and were looking to steal richer territory from the Clan. Tensions are eased when s_c informs the rogues of a prey-rich meadow outside of c_n territory.",
                "exp": 30,
                "weight": 20,
                "stat_trait": ["bold", "confident", "charismatic"],
                "relationships": [
                    {
                        "cats_to": ["patrol"],
                        "cats_from": ["patrol"],
                        "mutual": false,
                        "values": ["respect", "trust"],
                        "amount": 5
                    }
                ],
                "art": "gen_bord_otherclan_allies"
            },
            {
                "text": "s_c eagerly springs into action! {PRONOUN/s_c/poss/CAP} <i>special training</i> speaks for itself in the way s_c flawlessly performs battle move after battle move. With the rest of the patrol for backup, the rogues quickly turn tail and flee from such a terrifying cat!",
                "exp": 30,
                "weight": 10,
                "stat_skill": ["DARK,1"],
                "relationships": [
                    {
                        "cats_to": ["s_c"],
                        "cats_from": ["patrol"],
                        "mutual": false,
                        "values": ["comfort"],
                        "amount": -5
                    }
                  ],
                "art": "gen_bord_roguerunaway"
            }
        ],
        "fail_outcomes": [
            {
                "text": "The rogues are terrifyingly coordinated and are quick to use the patrol's shock and confusion against them. The patrol cats are picked off one by one, only a couple managing to escape the slaughter on the rocky slopes.",
                "exp": 0,
                "weight": 10,
                "dead_cats": ["multi"],
                "history_text": {
                    "scar": "m_c was badly scarred when rogues ambushed {PRONOUN/m_c/poss} patrol.",
                    "reg_death": "This cat was killed when rogues ambushed {PRONOUN/m_c/poss} patrol.",
                    "lead_death": "{VERB/m_c/were/was} killed in a rogue ambush"
                },
                "art": "gen_bord_otherclan_hostile"
            },
            {
                "text": "Taken by surprise, the patrol scatters and loses cohesion. The rogues are quick to take advantage of the confusion, and eventually the patrol retreats, r_c badly wounded.",
                "exp": 0,
                "weight": 10,
                "injury": [
                    {
                        "cats": ["r_c"],
                        "injuries": ["battle_injury"],
                        "scars": ["FACE"]
                    }
                ],
                "history_text": {
                    "scar": "m_c was badly scarred when rogues ambushed {PRONOUN/m_c/poss} patrol.",
                    "reg_death": "m_c was killed when rogues ambushed {PRONOUN/m_c/poss} patrol.",
                    "lead_death": "{VERB/m_c/were/was} killed in a rogue ambush"
                }
            }
        ]
    },
    {
        "patrol_id": "mtn_bord_rogue2",
        "biome": ["mountainous"],
        "season": ["any"],
        "types": ["border"],
        "tags": [],
        "patrol_art": "bord_general_intro",
        "min_cats": 1,
        "max_cats": 1,
        "min_max_status": {},
        "weight": 20,
        "intro_text": "As the patrol is marking the border lines, a gang of rogues leaps out from behind a tumble of rocks! An ambush!",
        "decline_text": "r_c turns tail and races away! The rogues have {PRONOUN/r_c/object} far outnumbered, and warning the Clan is more important than dying needlessly.",
        "chance_of_success": 30,
        "success_outcomes": [
            {
                "text": "Stunned for a moment, r_c is nearly caught in the teeth of the first rogue, but {PRONOUN/r_c/subject} {VERB/r_c/use/uses} {PRONOUN/r_c/poss} superior knowledge of the rocky terrain to dodge and weave through the onslaught of attacks, eventually escaping the fray and pelting towards camp with yowls of warning bursting from {PRONOUN/r_c/poss} lungs.",
                "exp": 30,
                "weight": 20
            },
            {
                "text": "s_c snarls at the rogues, outnumbered but not cowed. {PRONOUN/s_c/subject/CAP} {VERB/s_c/throw/throws} {PRONOUN/s_c/self} at the intruders with such ferocity that the rogues are taken aback. Alarmed by the Clan cat's lack of fear and self-preservation, the rogues freeze. s_c sees {PRONOUN/s_c/poss} opportunity to run and takes it, racing back to the camp to gather more warriors and return.",
                "exp": 30,
                "weight": 20,
                "stat_skill": ["FIGHTER,3"]
            }
        ],
        "fail_outcomes": [
            {
                "text": "s_c snarls at the rogues, outnumbered but not cowed. {PRONOUN/s_c/subject/CAP} {VERB/s_c/throw/throws} {PRONOUN/s_c/self} at the intruders with such ferocity that the rogues are taken aback. Their shock only lasts a moment before they descend upon the warrior once more. Eventually, s_c has no choice but to escape before {PRONOUN/s_c/subject} {VERB/s_c/are/is} killed.",
                "exp": 0,
                "weight": 20,
                "stat_trait": ["bloodthirsty", "fierce", "vengeful"]
            },
            {
                "text": "The rogues greatly outnumber r_c and have no trouble killing the lone cat. {PRONOUN/r_c/poss/CAP} body is discovered the next day, cold and covered in wounds.",
                "exp": 0,
                "weight": 10,
                "dead_cats": ["r_c"],
                "history_text": {
                    "reg_death": "This cat was killed when rogues ambushed {PRONOUN/m_c/object} while on a solo patrol.",